<?xml version="1.0" encoding="UTF-8"?>
<!-- Version: $Id: messages.xsd,v 1.3 2007/06/05 23:41:11 tdanard Exp $ -->
<xs:schema xmlns:xs="http://www.w3.org/2001/XMLSchema" elementFormDefault="qualified">
  <xs:element name="messages">
    <xs:complexType>
      <xs:sequence>
        <xs:element maxOccurs="unbounded" ref="message"/>
      </xs:sequence>
    </xs:complexType>
  </xs:element>
  <xs:element name="message">
    <xs:complexType>
      <xs:sequence>
        <xs:element ref="contents"/>
      </xs:sequence>
      <xs:attribute name="enabled-flag" use="required" type="xs:NCName"/>
      <xs:attribute name="id" use="required" type="xs:NCName"/>
      <xs:attribute name="type" use="required" type="xs:NCName"/>
    </xs:complexType>
  </xs:element>
  <xs:element name="contents">
    <xs:complexType>
      <xs:sequence>
        <xs:element maxOccurs="unbounded" ref="content"/>
      </xs:sequence>
    </xs:complexType>
  </xs:element>
  <xs:element name="content">
    <xs:complexType mixed="true">
      <xs:attribute name="extension-id" use="required" type="xs:NCName"/>
    </xs:complexType>
  </xs:element>
</xs:schema>
